<?xml version="1.0" encoding="UTF-8"?>
<archivio xmlns:xs="http://www.w3.org/2001/XMLSchema-instance" xs:noNamespaceSchemaLocation="volo.xsd">
	<cliente>
		<nome>Lorenzo</nome>
		<cognome>Pellegrino</cognome>
		<passaporto>123456789</passaporto>
		
		<prenotazione>
			<codice>ABCDEF</codice>
			<compagnia>Ryanair</compagnia>
			<tipo_volo>Solo-Andata</tipo_volo>
			<aeroporto_partenza>Bologna</aeroporto_partenza>
			<dataOra_partenza>2023-08-29T00:00:00</dataOra_partenza>
			<aeroporto_arrivo>Rimini</aeroporto_arrivo>
			<dataOra_arrivo>2023-08-30T00:00:00</dataOra_arrivo>
		</prenotazione>
		
		<prenotazione>
			<codice>GHIJKL</codice>
			<compagnia>Alitalia</compagnia>
			<tipo_volo>Solo-Andata</tipo_volo>
			<aeroporto_partenza>Bologna</aeroporto_partenza>
			<dataOra_partenza>2023-08-31T00:00:00</dataOra_partenza>
			<aeroporto_arrivo>Atene</aeroporto_arrivo>
			<dataOra_arrivo>2023-09-01T00:00:00</dataOra_arrivo>
		</prenotazione>
	</cliente>
	
	<cliente>
		<nome>Riccardo</nome>
		<cognome>Pellegrino</cognome>
		<passaporto>987654321</passaporto>
		
		<prenotazione>
			<codice>QWERTY</codice>
			<compagnia>Alitalia</compagnia>
			<tipo_volo>Solo-Andata</tipo_volo>
			<aeroporto_partenza>Bologna</aeroporto_partenza>
			<dataOra_partenza>2023-08-29T00:00:00</dataOra_partenza>
			<aeroporto_arrivo>Rimini</aeroporto_arrivo>
			<dataOra_arrivo>2023-08-30T00:00:00</dataOra_arrivo>
		</prenotazione>
		
		<prenotazione>
			<codice>ZXCVBN</codice>
			<compagnia>Alitalia</compagnia>
			<tipo_volo>Andata-Ritorno</tipo_volo>
			<aeroporto_partenza>Bologna</aeroporto_partenza>
			<dataOra_partenza>2023-08-31T00:00:00</dataOra_partenza>
			<aeroporto_arrivo>Atene</aeroporto_arrivo>
			<dataOra_arrivo>2023-09-01T00:00:00</dataOra_arrivo>
		</prenotazione>
	</cliente>
</archivio>